{
    "SamplesAnalysisID": "osdu:work-product-component--SamplesAnalysis:Multiple_Salinity_Example:",
    "TestMethod": "TestMethod",
    "SalinityTestResults": [
        {
            "SampleID": "osdu:master-data--Sample:88Y:",
            "BQv": {
                "Value": 3.5,
                "UnitOfMeasure": "opendes:reference-data--UnitOfMeasure:%25:"
            },
            "Qv": {
                "Value": 3.5,
                "UnitOfMeasure": "opendes:reference-data--UnitOfMeasure:%25:"
            }
        },
        {
            "SampleID": "osdu:master-data--Sample:88Y:",
            "BQv": {
                "Value": 4.5,
                "UnitOfMeasure": "opendes:reference-data--UnitOfMeasure:%25:"
            },
            "Qv": {
                "Value": 4.5,
                "UnitOfMeasure": "opendes:reference-data--UnitOfMeasure:%25:"
            }
        }
    ],
    "SalinityTestSteps": [
        {
            "BrineSalinity": {
                "Value": 3.5,
                "UnitOfMeasure": "opendes:reference-data--UnitOfMeasure:%25:"
            },
            "BrineConductivity": {
                "Value": 3.5,
                "UnitOfMeasure": "opendes:reference-data--UnitOfMeasure:%25:"
            },
            "CoreConductivity": {
                "Value": 3.5,
                "UnitOfMeasure": "opendes:reference-data--UnitOfMeasure:%25:"
            }
        }
    ]
}
